{
  "$schema": "https://json-schema.org/draft/2020-12/schema",
  "title": "Moved dates for a recurring rule in a single year",
  "type": "array",
  "items": {
    "type": "object",
    "additionalProperties": false,
    "required": ["rule_id", "year", "date", "reason", "source_ids", "verified"],
    "properties": {
      "rule_id": {"type": "string"},
      "year": {"type": "integer"},
      "date": {"type": "string", "pattern": "^\\d{4}-\\d{2}-\\d{2}$"},
      "reason": {"type": "string", "minLength": 1},
      "notes": {"type": ["string", "null"]},
      "source_ids": {"type": "array", "items": {"type": "string"}},
      "verified": {"type": "boolean"}
    }
  }
}
